{
  "schemaVersion": "1.0.0",
  "id": "rpt_c3eab08d-91f4-4d84-8c44-8c7dec4e57f2",
  "generatedAt": "2026-08-21T05:33:47.147Z",
  "project": {
    "name": "myrqen-fixture-vuln-shop",
    "workspaceKind": "personal",
    "workspaceName": "Personal",
    "repositoryLabel": "vuln-shop"
  },
  "scan": {
    "effortRequested": "auto",
    "effortResolved": "high",
    "effortProfile": {
      "reasoningPasses": 2,
      "validationPasses": 2,
      "maxParallelInvestigations": 4,
      "wallClockBudgetMs": 1500000,
      "falsePositiveChallengePass": true,
      "identityMatrixDepth": 2,
      "breadth": "broad"
    },
    "startedAt": "2026-08-21T05:16:18.171Z",
    "completedAt": "2026-08-21T05:33:47.147Z",
    "durationMs": 1048976,
    "agent": {
      "name": "benchmark-harness",
      "model": "candidate-driven-validator"
    },
    "host": {
      "osFamily": "darwin",
      "arch": "arm64",
      "runtimeVersion": "node 25.5.0",
      "cliVersion": "0.1.0",
      "isolatedRuntimeAvailable": false
    },
    "tokenUsage": {
      "source": "unavailable"
    },
    "scope": {
      "localTargets": [
        "http://127.0.0.1:4010"
      ],
      "externalTargets": []
    },
    "phases": [
      {
        "phase": "preflight",
        "state": "complete",
        "startedAt": "2026-08-21T05:16:18.171Z",
        "completedAt": "2026-08-21T05:16:19.702Z",
        "durationMs": 1531
      },
      {
        "phase": "source_review",
        "state": "complete",
        "startedAt": "2026-08-21T05:16:22.792Z",
        "completedAt": "2026-08-21T05:33:45.756Z",
        "durationMs": 1042964
      },
      {
        "phase": "scope",
        "state": "complete",
        "startedAt": "2026-08-21T05:16:21.561Z",
        "completedAt": "2026-08-21T05:33:45.018Z",
        "durationMs": 1043457
      },
      {
        "phase": "discovery",
        "state": "complete",
        "startedAt": "2026-08-21T05:16:22.156Z",
        "completedAt": "2026-08-21T05:33:45.383Z",
        "durationMs": 1043227
      },
      {
        "phase": "runtime_validation",
        "state": "complete",
        "startedAt": "2026-08-21T05:16:27.846Z",
        "completedAt": "2026-08-21T05:33:46.119Z",
        "durationMs": 1038273
      },
      {
        "phase": "access_control",
        "state": "complete",
        "startedAt": "2026-08-21T05:16:28.485Z",
        "completedAt": "2026-08-21T05:33:46.461Z",
        "durationMs": 1037976
      },
      {
        "phase": "validation",
        "state": "complete",
        "startedAt": "2026-08-21T05:33:46.802Z",
        "completedAt": "2026-08-21T05:33:46.802Z",
        "durationMs": 0
      },
      {
        "phase": "reporting",
        "state": "running",
        "startedAt": "2026-08-21T05:33:47.147Z"
      }
    ],
    "stack": {
      "languages": [
        "JavaScript"
      ],
      "frameworks": [],
      "packageManagers": [],
      "services": [
        "http://127.0.0.1:4010"
      ]
    }
  },
  "authorization": {
    "destructiveActionsAllowed": false,
    "prohibitedActions": [
      "denial_of_service",
      "resource_exhaustion",
      "mass_delete",
      "mass_mutation",
      "destructive_database_change",
      "destructive_filesystem_change",
      "persistence",
      "uncontrolled_account_creation",
      "spam_or_mass_messaging",
      "financial_or_billing_side_effect",
      "credential_theft_or_reuse",
      "malware_deployment",
      "scope_expansion",
      "unrelated_infrastructure_recon",
      "authorization_prompt_bypass",
      "policy_or_logging_tampering",
      "secret_exfiltration"
    ],
    "externalTargetAuthorization": "exact_origin_only",
    "localTargetsInScope": true,
    "notes": [
      "No external origin was authorized. Only local project targets were assessed.",
      "Isolated runtime checks were skipped on this machine. Other checks still ran."
    ]
  },
  "summary": {
    "findingCount": 14,
    "severityCounts": {
      "critical": 0,
      "high": 10,
      "medium": 4,
      "low": 0,
      "info": 0
    },
    "verificationCounts": {
      "verified": 9,
      "strong_evidence": 4,
      "needs_review": 1
    },
    "fixedCount": 0,
    "candidateCount": 15,
    "duplicateCount": 1
  },
  "findings": [
    {
      "id": "MYR-001",
      "title": "The `where` parameter is compiled as executable code",
      "category": "code_injection",
      "severity": "high",
      "verification": "strong_evidence",
      "summary": "This helper embeds its `where` parameter into source passed to Function, so whatever any caller supplies becomes code that runs in this process. The helper cannot make that safe on its own: every call site is now responsible for the parameter never containing caller input.",
      "impact": "Any route that lets user input reach this parameter is remote code execution, and a route that does so today looks identical to one that does not.",
      "affected": {
        "component": "query",
        "file": "src/db.js",
        "lineStart": 33,
        "lineEnd": 33
      },
      "evidence": [
        {
          "kind": "source",
          "description": "The `where` parameter is interpolated into code given to Function.",
          "snippet": "  if (!where) return rows;\n  // Unsafe: the caller's string is composed directly into executable logic.\n  const predicate = new Function(\"row\", `try { return (${where}); } catch (error) { return false; }`);\n  return rows.filter((row) => predicate(row));\n}",
          "location": "src/db.js:33"
        },
        {
          "kind": "source",
          "description": "Static analysis reasoning: Parameter `where` of this function appears inside the source argument of Function."
        }
      ],
      "remediation": "Compile the predicate from structured input instead of a string: accept a field, an operator from a fixed set, and a value, and build the comparison in code so nothing the caller sends is ever parsed as source.",
      "verificationPlan": "Call the helper with a parameter containing a side effect and confirm it is not executed; then confirm every call site passes only values built in code.",
      "status": "open",
      "firstSeenAt": "2026-08-21T05:16:20.215Z",
      "taxonomy": [
        "CWE-94",
        "CWE-95",
        "OWASP-A03"
      ],
      "tags": [
        "static-pass",
        "dynamic-predicate-compilation"
      ],
      "fingerprint": "fp_01c4e8f85f5511c62ed0c6701413f176",
      "corroboration": [
        {
          "kind": "source",
          "description": "A second review pass reached the same root cause from the source path rather than from the runtime probe."
        }
      ]
    },
    {
      "id": "MYR-002",
      "title": "Credential in source: credential assigned to BILLING_API_SECRET",
      "category": "hardcoded_secret",
      "severity": "high",
      "verification": "strong_evidence",
      "summary": "A credential assigned to BILLING_API_SECRET is present as a literal in src/server.js. Anyone who can read the repository, its history, a CI log, or a build artifact that contains this file holds the credential, and none of those audiences is the one it was issued to.",
      "impact": "The credential has to be treated as already compromised, because publication cannot be undone by deleting the line. What that costs depends on what it authorises: reading customer data, sending mail as the company, or spending money on the account it belongs to.",
      "affected": {
        "component": "src/server.js",
        "file": "src/server.js",
        "lineStart": 15,
        "lineEnd": 15,
        "route": "GET /"
      },
      "evidence": [
        {
          "kind": "source",
          "description": "A credential assigned to BILLING_API_SECRET appears as a literal. The value is deliberately not reproduced in this report.",
          "location": "src/server.js:15"
        },
        {
          "kind": "source",
          "description": "Static analysis reasoning: The literal is bound to a secret-named binding, is 41 characters with entropy 4.33, and contains no whitespace."
        }
      ],
      "remediation": "Rotate the credential first — the old value is burned. Then read the new one from the process environment or a secret manager, fail closed at startup when it is absent rather than falling back to a literal, and purge the value from git history. Add a pre-commit secret scan so the next one is caught before it lands.",
      "verificationPlan": "Confirm the rotated credential is loaded from configuration at runtime and that the application refuses to start without it. Then search the working tree and the full history for the shape and confirm no literal remains.",
      "status": "open",
      "firstSeenAt": "2026-08-21T05:16:20.259Z",
      "taxonomy": [
        "CWE-798",
        "CWE-259",
        "OWASP-A07"
      ],
      "tags": [
        "static-pass",
        "credential-literal"
      ],
      "fingerprint": "fp_170e72be4ec3c9366851605ca4968048"
    },
    {
      "id": "MYR-003",
      "title": "Session identifier `token` is derived from a MD5 digest of `${user.id}:${sessions.size}`",
      "category": "weak_session_identifier",
      "severity": "high",
      "verification": "strong_evidence",
      "summary": "`token` has to be unguessable to whoever receives it, but it is produced from a MD5 digest of `${user.id}:${sessions.size}`. A digest is deterministic, so the result is exactly as unguessable as what went into it. Every input here is something an attacker can observe, enumerate, or compute — an identifier, a counter, or the clock — so the value can be reconstructed offline. The value's role is settled by how it is used: it becomes the key of `sessions.set()`.",
      "impact": "An attacker who can reconstruct the inputs computes a valid session identifier offline and uses it without ever presenting a credential, which is account takeover with no sign-in and no audit trail that looks unusual.",